{
  "schema_version": "semantic_record_v1",
  "sample_id": "acmi_ai_demo_001",
  "source": {
    "platform": "afsim_acmi",
    "type": "acmi_ai",
    "scenario_id": "demo_2v2.acmi",
    "episode_id": "ep01",
    "timestamp_sec": 80.0,
    "annotator": "qwen3-4b",
    "tool": "acmi_auto_label_v1.py"
  },
  "obs": {
    "ego": {
      "runtime_id": "0xE1",
      "callsign": "Cobra1",
      "coalition": "red",
      "speed_mps": 290.0,
      "altitude_m": 9000.0,
      "heading_deg": 45.0,
      "pitch_deg": 0.5,
      "roll_deg": null,
      "vertical_speed_mps": 1.5,
      "pos_east_m": 10000.0,
      "pos_north_m": 30000.0,
      "energy_state": "high"
    },
    "enemy": {
      "target_ref": "enemy_1",
      "target_runtime_id": "0xF1",
      "callsign": "Raptor1",
      "range_m": 55000.0,
      "bearing_deg": 20.0,
      "aspect_deg": 175.0,
      "closure_mps": -150.0,
      "alt_diff_m": 500.0,
      "is_primary_threat": null
    },
    "ally": {
      "ally_ref": "ally_1",
      "ally_runtime_id": "0xE2",
      "callsign": "Cobra2",
      "range_m": 4000.0,
      "bearing_deg": -20.0,
      "is_supporting": null
    },
    "engagement": {
      "is_merge": false,
      "is_defensive": false,
      "has_shot_opportunity": null
    },
    "history": {
      "prev_semantic_state": "hold_geometry",
      "prev_token_family": "sustain",
      "prev_target_ref": "enemy_1"
    }
  },
  "label": {
    "semantic_state": "commit_intercept",
    "target_ref": "enemy_1",
    "role": "engaged",
    "constraints": {
      "prefer_energy_preserve": true,
      "allow_aggressive_turn": false,
      "must_support_teammate": false,
      "should_abort_if_threatened": false
    },
    "profile_hint": "p6dof_semantic",
    "event_flags": {
      "target_switch": false
    },
    "rationale_short": "???????? hold_geometry ?? commit_intercept"
  },
  "evidence": {
    "rule_ids": [],
    "acmi_refs": [
      "demo_2v2.acmi:0xE1:80.0"
    ],
    "frame_refs": [
      "frame_80.0"
    ],
    "notes": "range decreasing and small bearing; history indicates transition from hold_geometry | prompt=acmi_annotation_prompt_v1.txt | examples=acmi_auto_label_io_examples.json"
  },
  "quality": {
    "tier": "silver",
    "confidence": 0.84,
    "needs_review": false,
    "conflict_flag": false
  },
  "extras": {
    "raw_object_ids": null,
    "raw_tags": [
      "demo:acmi_ai"
    ],
    "weapon_event_refs": null
  }
}